{
  "schema_version": "alphafactory_execution_data_capture.v1",
  "created_at_utc": "2026-07-15T11:30:38.744416Z",
  "capture_id": "20260715_QFSI_REAL_007_LONG_ACCUMULATE",
  "purpose": "QFSI_DATA_FEASIBILITY_ONLY",
  "capture_mode": "PASSIVE_READ_ONLY",
  "broker_identity": {
    "expected_server": "FivePercentOnline-Real",
    "observed_server": "FivePercentOnline-Real",
    "server_fingerprint": "CE114ABFB8C653A060DAD7EA33FAF948B5786F691953B2D4E230EB7986120797",
    "account_fingerprint": "09DB5E9C091F23DF9E024E684BBA994D00CBD84CDEF2CFBA0C5D064EACCB32AB",
    "account_currency": "USD",
    "terminal_build": 6006
  },
  "research_gates": {
    "minimum_quote_elapsed_days": 90,
    "minimum_quote_rows_per_elapsed_day": 1000,
    "minimum_connected_heartbeat_ratio": 0.95,
    "maximum_heartbeat_gap_ms": 60000,
    "minimum_commission_lifecycles_per_symbol": 30,
    "minimum_slippage_fills_per_symbol": 100,
    "minimum_slippage_buys_per_symbol": 30,
    "minimum_slippage_sells_per_symbol": 30,
    "maximum_reference_age_ms": 1000
  },
  "symbols": [
    {
      "symbol": "USDJPY",
      "digits": 3,
      "point": 0.001,
      "pip_size": 0.01,
      "quote_ticks": {
        "status": "PARTIAL",
        "completeness_method": "PASSIVE_HEARTBEAT",
        "path": "USDJPY_quote_ticks.csv",
        "sha256": "E04C764A5CE4BF9CC792574FF087D0D3E1E6637127B3B65EC04FF52793B7BE89",
        "row_count": 14363
      },
      "heartbeats": {
        "status": "PARTIAL",
        "completeness_method": "PASSIVE_HEARTBEAT",
        "path": "USDJPY_heartbeats.csv",
        "sha256": "ABF71BE8BCFA761F3918D589EE1DAAA77F839C0C1D8A91ED56B0186A0FC7FC18",
        "row_count": 21377
      },
      "commission_lifecycles": {
        "status": "MISSING",
        "completeness_method": "NONE"
      },
      "slippage_fills": {
        "status": "MISSING",
        "completeness_method": "NONE"
      }
    },
    {
      "symbol": "EURUSD",
      "digits": 5,
      "point": 1e-05,
      "pip_size": 0.0001,
      "quote_ticks": {
        "status": "PARTIAL",
        "completeness_method": "PASSIVE_HEARTBEAT",
        "path": "EURUSD_quote_ticks.csv",
        "sha256": "B5418CCE08D3BAFE8AA747553C571955A76991FADE246F896E4B8C696CC4624E",
        "row_count": 11834
      },
      "heartbeats": {
        "status": "PARTIAL",
        "completeness_method": "PASSIVE_HEARTBEAT",
        "path": "EURUSD_heartbeats.csv",
        "sha256": "ABF71BE8BCFA761F3918D589EE1DAAA77F839C0C1D8A91ED56B0186A0FC7FC18",
        "row_count": 21377
      },
      "commission_lifecycles": {
        "status": "PARTIAL",
        "completeness_method": "ACCOUNT_HISTORY",
        "path": "EURUSD_commission_lifecycles.csv",
        "sha256": "96D54DA8120053F1B1079B022FCF29E066E8D842B915B8EA6C7EF68B0C915B68",
        "row_count": 2
      },
      "slippage_fills": {
        "status": "MISSING",
        "completeness_method": "NONE"
      }
    },
    {
      "symbol": "GBPUSD",
      "digits": 5,
      "point": 1e-05,
      "pip_size": 0.0001,
      "quote_ticks": {
        "status": "PARTIAL",
        "completeness_method": "PASSIVE_HEARTBEAT",
        "path": "GBPUSD_quote_ticks.csv",
        "sha256": "D343C877637C4A61BD8E5259993005741E9D49D7FB75AD1BB1C94CEDA3327569",
        "row_count": 16354
      },
      "heartbeats": {
        "status": "PARTIAL",
        "completeness_method": "PASSIVE_HEARTBEAT",
        "path": "GBPUSD_heartbeats.csv",
        "sha256": "ABF71BE8BCFA761F3918D589EE1DAAA77F839C0C1D8A91ED56B0186A0FC7FC18",
        "row_count": 21377
      },
      "commission_lifecycles": {
        "status": "MISSING",
        "completeness_method": "NONE"
      },
      "slippage_fills": {
        "status": "MISSING",
        "completeness_method": "NONE"
      }
    },
    {
      "symbol": "XAUUSD",
      "digits": 2,
      "point": 0.01,
      "pip_size": 0.01,
      "quote_ticks": {
        "status": "PARTIAL",
        "completeness_method": "PASSIVE_HEARTBEAT",
        "path": "XAUUSD_quote_ticks.csv",
        "sha256": "5BBF9BF80F3D560E22C1F084721BFE3050040F482163AB9E1C595D9D66116C0F",
        "row_count": 21351
      },
      "heartbeats": {
        "status": "PARTIAL",
        "completeness_method": "PASSIVE_HEARTBEAT",
        "path": "XAUUSD_heartbeats.csv",
        "sha256": "ABF71BE8BCFA761F3918D589EE1DAAA77F839C0C1D8A91ED56B0186A0FC7FC18",
        "row_count": 21377
      },
      "commission_lifecycles": {
        "status": "MISSING",
        "completeness_method": "NONE"
      },
      "slippage_fills": {
        "status": "MISSING",
        "completeness_method": "NONE"
      }
    }
  ],
  "safety": {
    "read_only": true,
    "orders_sent": 0,
    "positions_opened": 0,
    "live_trading_authorized": false
  }
}
